{
  "exercise_id": "RF-EX-103",
  "module": "rectus_femoris",
  "name": "Reverse Nordic tantrum variant",
  "aliases": [],
  "exercise_status": "draft",
  "approval_status": "pending",
  "executable": false,
  "permitted_use": "exercise_metadata_only",
  "body_region": [
    "anterior_thigh",
    "knee",
    "hip"
  ],
  "target_tissues": [
    "quadriceps",
    "rectus_femoris"
  ],
  "exercise_family": "long_length_eccentric_quad",
  "primary_function": [
    "supported_long_length_quad_loading"
  ],
  "movement_category": [
    "knee_extension_control",
    "long_length_loading"
  ],
  "joint_actions": [
    "knee_flexion_control",
    "hip_extension_context"
  ],
  "contraction_bias": [
    "eccentric_or_lengthened"
  ],
  "position_tags": [
    "kneeling",
    "long_length",
    "supported"
  ],
  "tissue_demand_tags": [
    "lengthened_anterior_thigh_load",
    "anterior_thigh_monitoring_required"
  ],
  "speed_power_demand": "low",
  "stretch_demand": "high",
  "impact_demand": "none",
  "field_demand_tags": [],
  "equipment": [
    "bodyweight",
    "assistance_optional"
  ],
  "setup_summary": "",
  "coaching_cues": [],
  "common_errors": [],
  "contraindications": [],
  "safety_blockers": [
    "active_red_flag",
    "rehab_blocked",
    "unresolved_external_restriction",
    "new_or_worsening_neurological_or_vascular_symptoms"
  ],
  "prerequisites": [
    "requires_future_selection_rules",
    "requires_current_safety_state",
    "requires_current_capacity_profile"
  ],
  "allowed_when": [
    "metadata_candidate_only",
    "requires_future_rule_authoring"
  ],
  "blocked_when": [
    "active_red_flag",
    "rehab_blocked",
    "unresolved_external_restriction",
    "symptom_worsening_after_exposure"
  ],
  "monitoring_triggers": [
    "pain_during",
    "pain_after",
    "next_day_response",
    "anterior_thigh_tightness",
    "loss_of_capacity"
  ],
  "progression_options": [],
  "regression_options": [],
  "substitution_options": [],
  "dosage_status": "requires_future_rule_authoring",
  "dosage": {
    "active_prescription_present": false,
    "prescribed_volume": null,
    "prescribed_load": null,
    "prescribed_tempo": null,
    "prescribed_schedule": null,
    "prescribed_recovery_interval": null,
    "prescribed_session_length": null,
    "prescribed_progression_step": null,
    "prescribed_target_timeline": null,
    "notes": "No active dosage authored. Dosage requires separately governed future rule authoring."
  },
  "source_refs": [],
  "evidence_claim_ids": [],
  "architecture_refs": [
    "Master_Architecture_V3.1_Final",
    "Master_Rectus_Femoris_Clinical_Rule_Specification_v1.2"
  ],
  "linked_rule_ids": [
    "RF-REHAB-002",
    "RF-REHAB-004",
    "RF-RECUR-002"
  ],
  "notes": "Batch 3 high-caution draft object; single non-peer-reviewed source, review required. Metadata only; not a prescription, dosage, progression, readiness, RTT/RTS, or clearance.",
  "canonical_name": "reverse_nordic_tantrum",
  "final_decision": "high_caution_do_not_convert_yet",
  "evidence_grade": "D",
  "source_authority": "low",
  "source_support_type": "contextual_support",
  "RF_specificity": "moderate",
  "central_tendon_fibrosis_risk": "high",
  "manual_review_required": true,
  "library_classification": "high_caution_sport_specific_exposure",
  "injury_site_relevance": [
    "central_intramuscular_tendon",
    "myotendinous",
    "muscular"
  ],
  "guardrail_notes": [
    "not a prescription",
    "not dosage",
    "not progression",
    "not readiness",
    "not RTT/RTS",
    "not clearance",
    "not a test"
  ],
  "source_ids": [
    "CR-S19"
  ],
  "source_verification_status": "unverified",
  "user_facing_name": "Reverse Nordic (supported)",
  "user_facing_summary": "A supported version of the kneeling lean-back.",
  "user_facing_purpose": "This builds front-thigh strength through a longer range, with support.",
  "user_facing_setup": "Kneel tall with hands ready to support you.",
  "user_facing_instructions": [
    "Kneel tall with hands ready to support you.",
    "Lean back slowly within a comfortable range.",
    "Use your hands to help return upright."
  ],
  "user_facing_common_mistakes": [
    "Leaning back too far.",
    "Bending at the hips."
  ],
  "user_facing_safety_note": "This is an advanced movement — keep the range small and stop if you feel sharp pain.",
  "plan_card_category": "strength",
  "plan_card_subcategory": "",
  "difficulty_label": "advanced",
  "advanced_label": "clinician_guided",
  "easier_option_labels": [
    "Short-arc knee extension"
  ],
  "harder_option_labels": [
    "Reverse Nordic"
  ],
  "related_exercise_labels": [
    "Reverse Nordic"
  ],
  "media": {
    "demo_video_url": null,
    "demo_video_asset_id": null,
    "image_asset_id": null,
    "animation_asset_id": null,
    "thumbnail_asset_id": null,
    "media_status": "none",
    "media_notes": null
  },
  "user_facing_status": "draft_copy",
  "log_completion_available": true,
  "log_pain_response_available": true,
  "log_difficulty_available": true,
  "log_confidence_available": false,
  "log_notes_available": true,
  "next_day_response_prompt_available": true
}
