{
  "exercise_id": "RF-EX-047",
  "module": "rectus_femoris",
  "name": "Butt-kickers drill",
  "aliases": [
    "butt kickers",
    "butt kicks running drill"
  ],
  "exercise_status": "draft",
  "approval_status": "pending",
  "executable": false,
  "permitted_use": "exercise_metadata_only",
  "body_region": [
    "hip",
    "knee",
    "anterior_thigh",
    "posterior_thigh",
    "lower_limb"
  ],
  "target_tissues": [
    "quadriceps_secondary",
    "rectus_femoris_secondary",
    "hamstrings_secondary"
  ],
  "exercise_family": "running_mechanics_preparation",
  "primary_function": [
    "running_cycle_preparation",
    "anterior_thigh_mobility_monitoring_context"
  ],
  "movement_category": [
    "running_drill",
    "dynamic_mobility",
    "mechanics_drill"
  ],
  "joint_actions": [
    "knee_flexion_cycling",
    "hip_extension_context"
  ],
  "contraction_bias": [
    "dynamic_repetitive"
  ],
  "position_tags": [
    "upright",
    "running_drill",
    "knee_flexion_cycling"
  ],
  "tissue_demand_tags": [
    "anterior_thigh_symptom_monitoring_required",
    "running_mechanics_demand"
  ],
  "speed_power_demand": "moderate",
  "stretch_demand": "moderate",
  "impact_demand": "moderate",
  "field_demand_tags": [
    "running_preparation"
  ],
  "equipment": [
    "open_space"
  ],
  "setup_summary": "",
  "coaching_cues": [],
  "common_errors": [],
  "contraindications": [],
  "safety_blockers": [
    "active_red_flag",
    "rehab_blocked",
    "unresolved_external_restriction",
    "new_or_worsening_neurological_or_vascular_symptoms"
  ],
  "prerequisites": [
    "requires_future_selection_rules",
    "requires_current_safety_state",
    "requires_current_capacity_profile",
    "requires_external_load_context"
  ],
  "allowed_when": [
    "metadata_candidate_only",
    "requires_future_rule_authoring",
    "exposure_metadata_only"
  ],
  "blocked_when": [
    "active_red_flag",
    "rehab_blocked",
    "unresolved_external_restriction",
    "symptom_worsening_after_exposure",
    "stretch_worsens_symptoms",
    "high_irritability"
  ],
  "monitoring_triggers": [
    "pain_during",
    "pain_after",
    "next_day_response",
    "anterior_thigh_tightness",
    "loss_of_capacity",
    "running_mechanics_breakdown"
  ],
  "progression_options": [],
  "regression_options": [],
  "substitution_options": [],
  "dosage_status": "requires_future_rule_authoring",
  "dosage": {
    "active_prescription_present": false,
    "prescribed_volume": null,
    "prescribed_load": null,
    "prescribed_tempo": null,
    "prescribed_schedule": null,
    "prescribed_recovery_interval": null,
    "prescribed_session_length": null,
    "prescribed_progression_step": null,
    "prescribed_target_timeline": null,
    "notes": "No active dosage authored. Dosage requires separately governed future rule authoring."
  },
  "source_refs": [
    "Aspetar_Rectus_Femoris_Injury_Rehabilitation_Pathway_2026",
    "Gonzalez_de_la_Flor_Garcia_Perez_de_Sevilla_2024_RF_strain_case_report",
    "Lorenz_Domzalski_2020_Return_to_Sprinting"
  ],
  "evidence_claim_ids": [],
  "architecture_refs": [
    "Master_Architecture_V3.1_Final",
    "Master_Rectus_Femoris_Clinical_Rule_Specification_v1.2"
  ],
  "linked_rule_ids": [
    "RF-FIELD-001",
    "RF-FIELD-003",
    "RF-RECUR-002"
  ],
  "notes": "Running-drill metadata only. Requires anterior-thigh symptom monitoring; no running prescription or progression authority.",
  "canonical_name": "butt_kick_drill",
  "final_decision": "second_batch_manual_review",
  "evidence_grade": "B",
  "source_authority": "moderate",
  "source_support_type": "direct_exercise_support",
  "RF_specificity": "low-moderate",
  "central_tendon_fibrosis_risk": "moderate",
  "manual_review_required": true,
  "library_classification": "running_field_exposure",
  "injury_site_relevance": [
    "muscular"
  ],
  "guardrail_notes": [
    "not a prescription",
    "not dosage",
    "not progression",
    "not readiness",
    "not RTT/RTS",
    "not clearance",
    "not a test"
  ],
  "source_ids": [
    "SG-S3",
    "CGDR-S3"
  ],
  "source_verification_status": "partially_verified",
  "user_facing_name": "Heel-flick drill",
  "user_facing_summary": "Flicking the heels toward the back in a running pattern.",
  "user_facing_purpose": "This helps prepare your legs for running movement.",
  "user_facing_setup": "Stand tall with space to move.",
  "user_facing_instructions": [
    "Stand tall with space to move.",
    "Flick one heel up toward your back, then the other.",
    "Keep a light, steady rhythm."
  ],
  "user_facing_common_mistakes": [
    "Arching the back.",
    "Going too fast too soon."
  ],
  "user_facing_safety_note": "Keep it light and stop if you feel sharp pain.",
  "plan_card_category": "running_preparation",
  "plan_card_subcategory": "",
  "difficulty_label": "controlled",
  "advanced_label": "none",
  "easier_option_labels": [
    "High-knee marching"
  ],
  "harder_option_labels": [],
  "related_exercise_labels": [
    "High-knee marching"
  ],
  "media": {
    "demo_video_url": null,
    "demo_video_asset_id": null,
    "image_asset_id": null,
    "animation_asset_id": null,
    "thumbnail_asset_id": null,
    "media_status": "none",
    "media_notes": null
  },
  "user_facing_status": "draft_copy",
  "log_completion_available": true,
  "log_pain_response_available": true,
  "log_difficulty_available": true,
  "log_confidence_available": false,
  "log_notes_available": true,
  "next_day_response_prompt_available": true
}
