{
  "exercise_id": "RF-EX-016",
  "module": "rectus_femoris",
  "name": "Step-up",
  "aliases": [
    "box step-up"
  ],
  "exercise_status": "draft",
  "approval_status": "pending",
  "executable": false,
  "permitted_use": "exercise_metadata_only",
  "body_region": [
    "lower_limb",
    "hip",
    "knee",
    "anterior_thigh"
  ],
  "target_tissues": [
    "quadriceps",
    "gluteals",
    "lower_limb"
  ],
  "exercise_family": "quadriceps_lower_limb_strength_control",
  "primary_function": [
    "single_leg_strength",
    "lower_limb_control"
  ],
  "movement_category": [
    "step_up",
    "single_leg_strength"
  ],
  "joint_actions": [
    "hip_extension",
    "knee_extension"
  ],
  "contraction_bias": [
    "isotonic"
  ],
  "position_tags": [
    "single_leg_bias",
    "vertical_push",
    "closed_chain"
  ],
  "tissue_demand_tags": [
    "quadriceps_load",
    "gluteal_load"
  ],
  "speed_power_demand": "low_to_moderate",
  "stretch_demand": "low",
  "impact_demand": "low",
  "field_demand_tags": [],
  "equipment": [
    "step_or_box"
  ],
  "setup_summary": "",
  "coaching_cues": [],
  "common_errors": [],
  "contraindications": [],
  "safety_blockers": [
    "active_red_flag",
    "rehab_blocked",
    "unresolved_external_restriction",
    "new_or_worsening_neurological_or_vascular_symptoms"
  ],
  "prerequisites": [
    "requires_future_selection_rules",
    "requires_current_safety_state",
    "requires_current_capacity_profile"
  ],
  "allowed_when": [
    "metadata_candidate_only",
    "requires_future_rule_authoring"
  ],
  "blocked_when": [
    "active_red_flag",
    "rehab_blocked",
    "unresolved_external_restriction",
    "symptom_worsening_after_exposure"
  ],
  "monitoring_triggers": [
    "pain_during",
    "pain_after",
    "next_day_response",
    "anterior_thigh_tightness",
    "loss_of_capacity"
  ],
  "progression_options": [],
  "regression_options": [],
  "substitution_options": [],
  "dosage_status": "requires_future_rule_authoring",
  "dosage": {
    "active_prescription_present": false,
    "prescribed_volume": null,
    "prescribed_load": null,
    "prescribed_tempo": null,
    "prescribed_schedule": null,
    "prescribed_recovery_interval": null,
    "prescribed_session_length": null,
    "prescribed_progression_step": null,
    "prescribed_target_timeline": null,
    "notes": "No active dosage authored. Dosage requires separately governed future rule authoring."
  },
  "source_refs": [
    "Gonzalez_de_la_Flor_Garcia_Perez_de_Sevilla_2024_RF_strain_case_report",
    "Lorenz_Domzalski_2020_Return_to_Sprinting"
  ],
  "evidence_claim_ids": [],
  "architecture_refs": [
    "Master_Architecture_V3.1_Final",
    "Master_Rectus_Femoris_Clinical_Rule_Specification_v1.2"
  ],
  "linked_rule_ids": [
    "RF-REHAB-001",
    "RF-REHAB-002",
    "RF-REHAB-005",
    "RF-REHAB-006"
  ],
  "notes": "Metadata only. Do not treat as readiness test or clearance criterion.",
  "canonical_name": "step_up",
  "final_decision": "first_batch_safe_metadata",
  "evidence_grade": "B",
  "source_authority": "moderate",
  "source_support_type": "direct_exercise_support",
  "RF_specificity": "moderate",
  "central_tendon_fibrosis_risk": "low",
  "manual_review_required": false,
  "library_classification": "rf_core_loading",
  "injury_site_relevance": [
    "muscular"
  ],
  "guardrail_notes": [
    "not a prescription",
    "not dosage",
    "not progression",
    "not readiness",
    "not RTT/RTS",
    "not clearance",
    "not a test"
  ],
  "source_ids": [
    "SG-S3",
    "CGDR-S3",
    "CGDR-S4"
  ],
  "source_verification_status": "partially_verified",
  "user_facing_name": "Step-up",
  "user_facing_summary": "Stepping up onto a low step.",
  "user_facing_purpose": "This helps rebuild leg strength and control.",
  "user_facing_setup": "Stand facing a low, stable step.",
  "user_facing_instructions": [
    "Stand facing a low, stable step.",
    "Step up leading with your injured leg.",
    "Step back down slowly with control."
  ],
  "user_facing_common_mistakes": [
    "Pushing off the back leg too much.",
    "Letting the knee fall inward."
  ],
  "user_facing_safety_note": "Use a low step and stop if you feel sharp pain.",
  "plan_card_category": "strength",
  "plan_card_subcategory": "",
  "difficulty_label": "controlled",
  "advanced_label": "none",
  "easier_option_labels": [
    "Glute bridge",
    "Short-arc knee extension"
  ],
  "harder_option_labels": [],
  "related_exercise_labels": [
    "Single-leg balance reach"
  ],
  "media": {
    "demo_video_url": null,
    "demo_video_asset_id": null,
    "image_asset_id": null,
    "animation_asset_id": null,
    "thumbnail_asset_id": null,
    "media_status": "none",
    "media_notes": null
  },
  "user_facing_status": "draft_copy",
  "log_completion_available": true,
  "log_pain_response_available": true,
  "log_difficulty_available": true,
  "log_confidence_available": false,
  "log_notes_available": true,
  "next_day_response_prompt_available": true
}
