{
  "exercise_id": "RF-EX-096",
  "module": "rectus_femoris",
  "name": "Step-down",
  "aliases": [],
  "exercise_status": "draft",
  "approval_status": "pending",
  "executable": false,
  "permitted_use": "exercise_metadata_only",
  "body_region": [
    "hip",
    "knee",
    "anterior_thigh",
    "lower_limb"
  ],
  "target_tissues": [
    "quadriceps",
    "gluteals",
    "lower_limb"
  ],
  "exercise_family": "unilateral_knee_dominant_eccentric",
  "primary_function": [
    "single_leg_eccentric_control"
  ],
  "movement_category": [
    "step_down",
    "single_leg_eccentric_control"
  ],
  "joint_actions": [
    "hip_knee_flexion_control"
  ],
  "contraction_bias": [
    "eccentric_control",
    "isotonic"
  ],
  "position_tags": [
    "single_leg",
    "eccentric_lowering"
  ],
  "tissue_demand_tags": [
    "quadriceps_eccentric_demand",
    "single_leg_control_demand"
  ],
  "speed_power_demand": "low_to_moderate",
  "stretch_demand": "low",
  "impact_demand": "low",
  "field_demand_tags": [],
  "equipment": [
    "low_step"
  ],
  "setup_summary": "",
  "coaching_cues": [],
  "common_errors": [],
  "contraindications": [],
  "safety_blockers": [
    "active_red_flag",
    "rehab_blocked",
    "unresolved_external_restriction",
    "new_or_worsening_neurological_or_vascular_symptoms"
  ],
  "prerequisites": [
    "requires_future_selection_rules",
    "requires_current_safety_state",
    "requires_current_capacity_profile"
  ],
  "allowed_when": [
    "metadata_candidate_only",
    "requires_future_rule_authoring"
  ],
  "blocked_when": [
    "active_red_flag",
    "rehab_blocked",
    "unresolved_external_restriction",
    "symptom_worsening_after_exposure"
  ],
  "monitoring_triggers": [
    "pain_during",
    "pain_after",
    "next_day_response",
    "anterior_thigh_tightness",
    "loss_of_capacity"
  ],
  "progression_options": [],
  "regression_options": [],
  "substitution_options": [],
  "dosage_status": "requires_future_rule_authoring",
  "dosage": {
    "active_prescription_present": false,
    "prescribed_volume": null,
    "prescribed_load": null,
    "prescribed_tempo": null,
    "prescribed_schedule": null,
    "prescribed_recovery_interval": null,
    "prescribed_session_length": null,
    "prescribed_progression_step": null,
    "prescribed_target_timeline": null,
    "notes": "No active dosage authored. Dosage requires separately governed future rule authoring."
  },
  "source_refs": [],
  "evidence_claim_ids": [],
  "architecture_refs": [
    "Master_Architecture_V3.1_Final",
    "Master_Rectus_Femoris_Clinical_Rule_Specification_v1.2"
  ],
  "linked_rule_ids": [
    "RF-REHAB-002",
    "RF-REHAB-005"
  ],
  "notes": "Batch 2 normalized manual-review eccentric-control object. Metadata only; not a prescription, dosage, progression, readiness, RTT/RTS, or clearance.",
  "canonical_name": "step_down",
  "final_decision": "second_batch_manual_review",
  "evidence_grade": "B",
  "source_authority": "moderate",
  "source_support_type": "direct_exercise_support",
  "RF_specificity": "moderate",
  "central_tendon_fibrosis_risk": "moderate",
  "manual_review_required": true,
  "library_classification": "manual_review_strength_running_prep",
  "injury_site_relevance": [
    "muscular"
  ],
  "guardrail_notes": [
    "not a prescription",
    "not dosage",
    "not progression",
    "not readiness",
    "not RTT/RTS",
    "not clearance",
    "not a test"
  ],
  "source_ids": [
    "CGDR-S4"
  ],
  "source_verification_status": "partially_verified",
  "user_facing_name": "Step-down",
  "user_facing_summary": "Lowering off a low step with control.",
  "user_facing_purpose": "This helps build single-leg control as your leg lowers.",
  "user_facing_setup": "Stand on a low, stable step.",
  "user_facing_instructions": [
    "Stand on a low, stable step.",
    "Slowly lower one foot toward the floor.",
    "Rise back up with control."
  ],
  "user_facing_common_mistakes": [
    "Dropping down quickly.",
    "Letting the knee fall inward."
  ],
  "user_facing_safety_note": "Use a low step and stop if you feel sharp pain.",
  "plan_card_category": "strength",
  "plan_card_subcategory": "",
  "difficulty_label": "controlled",
  "advanced_label": "none",
  "easier_option_labels": [
    "Step-up"
  ],
  "harder_option_labels": [],
  "related_exercise_labels": [
    "Step-up"
  ],
  "media": {
    "demo_video_url": null,
    "demo_video_asset_id": null,
    "image_asset_id": null,
    "animation_asset_id": null,
    "thumbnail_asset_id": null,
    "media_status": "none",
    "media_notes": null
  },
  "user_facing_status": "draft_copy",
  "log_completion_available": true,
  "log_pain_response_available": true,
  "log_difficulty_available": true,
  "log_confidence_available": false,
  "log_notes_available": true,
  "next_day_response_prompt_available": true
}
