{
  "exercise_id": "RF-EX-091",
  "module": "rectus_femoris",
  "name": "Terminal / short-arc knee extension",
  "aliases": [],
  "exercise_status": "draft",
  "approval_status": "pending",
  "executable": false,
  "permitted_use": "exercise_metadata_only",
  "body_region": [
    "anterior_thigh",
    "knee"
  ],
  "target_tissues": [
    "quadriceps",
    "rectus_femoris"
  ],
  "exercise_family": "isotonic_knee_extensor",
  "primary_function": [
    "inner_range_knee_extensor_loading"
  ],
  "movement_category": [
    "knee_extension",
    "strength_loading"
  ],
  "joint_actions": [
    "knee_extension"
  ],
  "contraction_bias": [
    "isotonic"
  ],
  "position_tags": [
    "inner_range",
    "short_arc"
  ],
  "tissue_demand_tags": [
    "low_anterior_thigh_load"
  ],
  "speed_power_demand": "low_to_moderate",
  "stretch_demand": "low",
  "impact_demand": "none",
  "field_demand_tags": [],
  "equipment": [
    "bodyweight",
    "small_support_optional"
  ],
  "setup_summary": "",
  "coaching_cues": [],
  "common_errors": [],
  "contraindications": [],
  "safety_blockers": [
    "active_red_flag",
    "rehab_blocked",
    "unresolved_external_restriction",
    "new_or_worsening_neurological_or_vascular_symptoms"
  ],
  "prerequisites": [
    "requires_future_selection_rules",
    "requires_current_safety_state",
    "requires_current_capacity_profile"
  ],
  "allowed_when": [
    "metadata_candidate_only",
    "requires_future_rule_authoring"
  ],
  "blocked_when": [
    "active_red_flag",
    "rehab_blocked",
    "unresolved_external_restriction",
    "symptom_worsening_after_exposure"
  ],
  "monitoring_triggers": [
    "pain_during",
    "pain_after",
    "next_day_response",
    "anterior_thigh_tightness",
    "loss_of_capacity"
  ],
  "progression_options": [],
  "regression_options": [],
  "substitution_options": [],
  "dosage_status": "requires_future_rule_authoring",
  "dosage": {
    "active_prescription_present": false,
    "prescribed_volume": null,
    "prescribed_load": null,
    "prescribed_tempo": null,
    "prescribed_schedule": null,
    "prescribed_recovery_interval": null,
    "prescribed_session_length": null,
    "prescribed_progression_step": null,
    "prescribed_target_timeline": null,
    "notes": "No active dosage authored. Dosage requires separately governed future rule authoring."
  },
  "source_refs": [],
  "evidence_claim_ids": [],
  "architecture_refs": [
    "Master_Architecture_V3.1_Final",
    "Master_Rectus_Femoris_Clinical_Rule_Specification_v1.2"
  ],
  "linked_rule_ids": [
    "RF-REHAB-001",
    "RF-REHAB-002"
  ],
  "notes": "Batch 1 normalized first-safe RF inner-range loading object. Metadata only; not a prescription, dosage, progression, readiness, RTT/RTS, or clearance.",
  "canonical_name": "terminal_knee_extension",
  "final_decision": "first_batch_safe_metadata",
  "evidence_grade": "B",
  "source_authority": "moderate",
  "source_support_type": "direct_exercise_support",
  "RF_specificity": "moderate",
  "central_tendon_fibrosis_risk": "low",
  "manual_review_required": false,
  "library_classification": "rf_core_loading",
  "injury_site_relevance": [
    "muscular"
  ],
  "guardrail_notes": [
    "not a prescription",
    "not dosage",
    "not progression",
    "not readiness",
    "not RTT/RTS",
    "not clearance",
    "not a test"
  ],
  "source_ids": [
    "CR-S18",
    "CR-S11"
  ],
  "source_verification_status": "verified",
  "user_facing_name": "Short-arc knee extension",
  "user_facing_summary": "Straightening the knee through a small range.",
  "user_facing_purpose": "This helps strengthen the front of your thigh near full straightening.",
  "user_facing_setup": "Place a small rolled support under your knee.",
  "user_facing_instructions": [
    "Place a small rolled support under your knee.",
    "Straighten your knee by lifting your foot.",
    "Lower it back down slowly."
  ],
  "user_facing_common_mistakes": [
    "Locking the knee hard.",
    "Using a large range too soon."
  ],
  "user_facing_safety_note": "Keep the range small and stop if you feel sharp pain.",
  "plan_card_category": "strength",
  "plan_card_subcategory": "",
  "difficulty_label": "controlled",
  "advanced_label": "none",
  "easier_option_labels": [
    "Quad set"
  ],
  "harder_option_labels": [
    "Straight-leg raise"
  ],
  "related_exercise_labels": [
    "Quad set",
    "Straight-leg raise"
  ],
  "media": {
    "demo_video_url": null,
    "demo_video_asset_id": null,
    "image_asset_id": null,
    "animation_asset_id": null,
    "thumbnail_asset_id": null,
    "media_status": "none",
    "media_notes": null
  },
  "user_facing_status": "draft_copy",
  "log_completion_available": true,
  "log_pain_response_available": true,
  "log_difficulty_available": true,
  "log_confidence_available": false,
  "log_notes_available": true,
  "next_day_response_prompt_available": true
}
